{
  "$defs": {
    "IncidentStatus": {
      "description": "Lifecycle state of an incident response case.",
      "enum": [
        "open",
        "triaged",
        "contained",
        "eradicated",
        "recovered",
        "closed"
      ],
      "title": "IncidentStatus",
      "type": "string"
    },
    "Severity": {
      "description": "Normalized severity scale shared by findings, alerts and reports.",
      "enum": [
        "info",
        "low",
        "medium",
        "high",
        "critical"
      ],
      "title": "Severity",
      "type": "string"
    },
    "Source": {
      "description": "Producing module for a given object (provenance).",
      "enum": [
        "argus",
        "helios",
        "artemis",
        "proteus",
        "hermes",
        "apollo",
        "minerva",
        "vulcan",
        "athena",
        "themis",
        "aegis",
        "mars",
        "manual"
      ],
      "title": "Source",
      "type": "string"
    }
  },
  "$id": "urn:olympus:schema:olympus.incident:1.0.0",
  "$schema": "https://json-schema.org/draft/2020-12/schema",
  "additionalProperties": false,
  "description": "An incident response case linking alerts, evidence and lifecycle state.",
  "properties": {
    "alert_ids": {
      "items": {
        "type": "string"
      },
      "title": "Alert Ids",
      "type": "array"
    },
    "closed_at": {
      "anyOf": [
        {
          "format": "date-time",
          "type": "string"
        },
        {
          "type": "null"
        }
      ],
      "default": null,
      "title": "Closed At"
    },
    "engagement_id": {
      "anyOf": [
        {
          "type": "string"
        },
        {
          "type": "null"
        }
      ],
      "default": null,
      "title": "Engagement Id"
    },
    "evidence_ids": {
      "items": {
        "type": "string"
      },
      "title": "Evidence Ids",
      "type": "array"
    },
    "incident_id": {
      "title": "Incident Id",
      "type": "string"
    },
    "opened_at": {
      "format": "date-time",
      "title": "Opened At",
      "type": "string"
    },
    "owner": {
      "anyOf": [
        {
          "type": "string"
        },
        {
          "type": "null"
        }
      ],
      "default": null,
      "title": "Owner"
    },
    "schema_name": {
      "const": "olympus.incident",
      "default": "olympus.incident",
      "title": "Schema Name",
      "type": "string"
    },
    "schema_version": {
      "const": "1.0.0",
      "default": "1.0.0",
      "title": "Schema Version",
      "type": "string"
    },
    "severity": {
      "$ref": "#/$defs/Severity",
      "default": "medium"
    },
    "source": {
      "$ref": "#/$defs/Source"
    },
    "status": {
      "$ref": "#/$defs/IncidentStatus",
      "default": "open"
    },
    "summary": {
      "default": "",
      "title": "Summary",
      "type": "string"
    },
    "title": {
      "minLength": 1,
      "title": "Title",
      "type": "string"
    },
    "updated_at": {
      "format": "date-time",
      "title": "Updated At",
      "type": "string"
    }
  },
  "required": [
    "title",
    "source"
  ],
  "title": "Incident",
  "type": "object"
}
